{
  "newReleaseId": "a3f1c2b4-5e6d-47f8-9a1b-2c3d4e5f6789",
  "previousReleaseId": "11112222-3333-4444-5555-666677778888",
  "publishedDate": "2026-07-01",
  "variantCount": 4453798,
  "ingestedAt": "2026-08-07T03:12:44.001Z",
  "changedKeys": ["variantAnnotation:17:41197588:G:A", "variantAnnotation:13:32398489:A:G"]
}
